<?xml version="1.0" encoding="utf-8"?>
<buffer_npcs xmlns:xsi="http://www.w3.org/2001/XMLSchema-instance" xsi:noNamespaceSchemaLocation="xsd/buffer_npcs.xsd">
	<buffer_npc id="1000006" can_heal="true" can_cancel="true">
		<buff_cat ident="BC_FIGHTER" is_preset="true"/>
		<buff_cat ident="BC_MAGE" is_preset="true"/>

		<buff_cat ident="BC_BUFFS" is_preset="false"/>
		<buff_cat ident="BC_SONGS" is_preset="false"/>
		<buff_cat ident="BC_DANCES" is_preset="false"/>
		<buff_cat ident="BC_CHANTS" is_preset="false"/>
		<buff_cat ident="BC_DWARVEN" is_preset="false"/>
		<buff_cat ident="BC_RESIST" is_preset="false"/>
		<buff_cat ident="BC_SPECIAL" is_preset="false"/>
		<buff_cat ident="BC_OVERLORD" is_preset="false"/>
	</buffer_npc>
</buffer_npcs>